{
  "schemaVersion": 2,
  "id": "llama-demo-project",
  "name": "llama.cpp function demo",
  "root": ".",
  "documents": [
    {
      "id": "math-tools-document",
      "path": "math_tools.py",
      "cards": [
        { "id": "demo-clamp", "kind": "function" },
        { "id": "demo-normalize-score", "kind": "function" }
      ]
    }
  ],
  "layout": {},
  "queue": { "scope": "project", "entries": [] }
}
